{"schema_version":"1.0","rfam_acc":"RF00167","definitions":{"rows":"[unit_id_1, fr3d_class, unit_id_2] as written by fr3d-python (BGSU unit ids); near (n-prefixed) base-pair classes only, both residues in family chains of the entry; all models and symmetry operators as annotated (filtered downstream like the BGSU files)","n_true_rows_local":"true (non-near) base-pair rows of the same run between family chains; not used downstream (BGSU is the source of true base pairs), kept for comparison"},"provenance":{"tool":"fr3d-python fr3d/classifiers/NA_pairwise_interactions.py","repository":"https://github.com/BGSU-RNA/fr3d-python","commit":"3feb9b93e179187f45e1b79f3842d1a0ca19d797","commit_date":"2026-10-15","categories":"basepair,near","environment":{"python":"3.11.9","numpy":"2.4.6","scipy":"1.17.1","biopython":"1.88","mmcif-pdbx":"2.1.0"},"licence":"fr3d-python: license.txt is MIT (Copyright 2026 BGSU RNA Group); pyproject.toml declares Apache-2.0 (both permissive; discrepancy upstream)","coordinates":"PDBe updated mmCIF (streamed to a temporary directory, deleted after annotation)","url_template":"https://www.ebi.ac.uk/pdbe/entry-files/download/{pdb}_updated.cif","pipeline_version":"0.1.0","generated":"2026-10-22T15:52:59+00:00","method":"experiments/sscons_vs_3d/NEAR_CHECK.md (validated: local true pairs identical to BGSU in 298 of 321 chains)"},"summary":{"n_entries":66,"n_ok":66,"n_failed":0,"n_near_rows":684},"entries":{"1Y26":{"chains":["X"],"status":"ok","url":"https://www.ebi.ac.uk/pdbe/entry-files/download/1y26_updated.cif","retrieved":"2026-10-22","cif_sha256":"d7e61c496615dace86512180bda987ae57c463d20cd5488d333f392288f02a76","n_near_rows":8,"n_true_rows_local":68,"rows":[["1Y26|1|X|A|33","ncSS","1Y26|1|X|G|37"],["1Y26|1|X|A|35","ntHH","1Y26|1|X|A|64"],["1Y26|1|X|A|64","ntHH","1Y26|1|X|A|35"],["1Y26|1|X|G|37","ncSS","1Y26|1|X|A|33"],["1Y26|1|X|G|37","ncSS","1Y26|1|X|U|34"],["1Y26|1|X|U|34","ncSS","1Y26|1|X|G|37"],["1Y26|1|X|U|47","ntWH","1Y26|1|X|U|51"],["1Y26|1|X|U|51","ntHW","1Y26|1|X|U|47"]]},"1Y27":{"chains":["X"],"status":"ok","url":"https://www.ebi.ac.uk/pdbe/entry-files/download/1y27_updated.cif","retrieved":"2026-10-22","cif_sha256":"91fa65d51f79be94acb8c0c36d39544968d81f083c984ad5dff48ddf103db706","n_near_rows":4,"n_true_rows_local":66,"rows":[["1Y27|1|X|A|66","ntWS","1Y27|1|X|G|38"],["1Y27|1|X|G|37","ncSS","1Y27|1|X|U|34"],["1Y27|1|X|G|38","ntSW","1Y27|1|X|A|66"],["1Y27|1|X|U|34","ncSS","1Y27|1|X|G|37"]]},"2B57":{"chains":["A"],"status":"ok","url":"https://www.ebi.ac.uk/pdbe/entry-files/download/2b57_updated.cif","retrieved":"2026-10-22","cif_sha256":"4972dbd246791b426e2cb83276d0bf8cfc69006135d5904db46aa34c0dba0175","n_near_rows":2,"n_true_rows_local":64,"rows":[["2B57|1|A|A|44","ncWW","2B57|1|A|C|26"],["2B57|1|A|C|26","ncWW","2B57|1|A|A|44"]]},"2EES":{"chains":["A"],"status":"ok","url":"https://www.ebi.ac.uk/pdbe/entry-files/download/2ees_updated.cif","retrieved":"2026-10-22","cif_sha256":"bb24da7e5d5f3436aa6e1f0d2f1f100b3282d7d76493c4530c31d8c6bb6a38f4","n_near_rows":4,"n_true_rows_local":66,"rows":[["2EES|1|A|G|37","ncSS","2EES|1|A|U|34"],["2EES|1|A|U|34","ncSS","2EES|1|A|G|37"],["2EES|1|A|U|47","ntWH","2EES|1|A|U|51"],["2EES|1|A|U|51","ntHW","2EES|1|A|U|47"]]},"2EET":{"chains":["A"],"status":"ok","url":"https://www.ebi.ac.uk/pdbe/entry-files/download/2eet_updated.cif","retrieved":"2026-10-22","cif_sha256":"5da9f9d25465cd46aabfe9e6810b340368d1278fa4916c5cf82a82f4b7ac02ad","n_near_rows":4,"n_true_rows_local":66,"rows":[["2EET|1|A|G|37","ncSS","2EET|1|A|U|34"],["2EET|1|A|U|34","ncSS","2EET|1|A|G|37"],["2EET|1|A|U|47","ntWH","2EET|1|A|U|51"],["2EET|1|A|U|51","ntHW","2EET|1|A|U|47"]]},"2EEU":{"chains":["A"],"status":"ok","url":"https://www.ebi.ac.uk/pdbe/entry-files/download/2eeu_updated.cif","retrieved":"2026-10-22","cif_sha256":"b6d6eb7ea8964f7fb5d9a6bbac0135b270c971b278b77af3c12998548aa7564b","n_near_rows":4,"n_true_rows_local":66,"rows":[["2EEU|1|A|G|37","ncSS","2EEU|1|A|U|34"],["2EEU|1|A|U|34","ncSS","2EEU|1|A|G|37"],["2EEU|1|A|U|47","ntWH","2EEU|1|A|U|51"],["2EEU|1|A|U|51","ntHW","2EEU|1|A|U|47"]]},"2EEV":{"chains":["A"],"status":"ok","url":"https://www.ebi.ac.uk/pdbe/entry-files/download/2eev_updated.cif","retrieved":"2026-10-22","cif_sha256":"7aeff07a0e92f0f4ea42a7c6849de4278f0b53b64d159291a427a82e28918b95","n_near_rows":6,"n_true_rows_local":66,"rows":[["2EEV|1|A|A|44","ncWW","2EEV|1|A|C|26"],["2EEV|1|A|C|26","ncWW","2EEV|1|A|A|44"],["2EEV|1|A|G|37","ncSS","2EEV|1|A|U|34"],["2EEV|1|A|U|34","ncSS","2EEV|1|A|G|37"],["2EEV|1|A|U|47","ntWH","2EEV|1|A|U|51"],["2EEV|1|A|U|51","ntHW","2EEV|1|A|U|47"]]},"2EEW":{"chains":["A"],"status":"ok","url":"https://www.ebi.ac.uk/pdbe/entry-files/download/2eew_updated.cif","retrieved":"2026-10-22","cif_sha256":"16e5a6256196830f92280e8601d502691825ae84ab79b8e0ee14fce03b35818e","n_near_rows":8,"n_true_rows_local":66,"rows":[["2EEW|1|A|A|21","ncSS","2EEW|1|A|C|47"],["2EEW|1|A|A|44","ncWW","2EEW|1|A|C|26"],["2EEW|1|A|C|26","ncWW","2EEW|1|A|A|44"],["2EEW|1|A|C|47","ncSS","2EEW|1|A|A|21"],["2EEW|1|A|C|47","ncWW","2EEW|1|A|U|51"],["2EEW|1|A|G|37","ncSS","2EEW|1|A|U|34"],["2EEW|1|A|U|34","ncSS","2EEW|1|A|G|37"],["2EEW|1|A|U|51","ncWW","2EEW|1|A|C|47"]]},"2G9C":{"chains":["A"],"status":"ok","url":"https://www.ebi.ac.uk/pdbe/entry-files/download/2g9c_updated.cif","retrieved":"2026-10-22","cif_sha256":"5a32f467f54a41aa3d9fd45c76c29c4cc4df3faea5130d7e5ea10364aef4d3a8","n_near_rows":6,"n_true_rows_local":68,"rows":[["2G9C|1|A|3AY|91","ntSW","2G9C|1|A|U|51"],["2G9C|1|A|G|37","ncSS","2G9C|1|A|U|34"],["2G9C|1|A|U|34","ncSS","2G9C|1|A|G|37"],["2G9C|1|A|U|47","ntWH","2G9C|1|A|U|51"],["2G9C|1|A|U|51","ntHW","2G9C|1|A|U|47"],["2G9C|1|A|U|51","ntWS","2G9C|1|A|3AY|91"]]},"2XNW":{"chains":["A"],"status":"ok","url":"https://www.ebi.ac.uk/pdbe/entry-files/download/2xnw_updated.cif","retrieved":"2026-10-22","cif_sha256":"56a79756a640591f70a389ca45714de2a87052b7285f268638bbf2299de1facd","n_near_rows":6,"n_true_rows_local":62,"rows":[["2XNW|1|A|A|44","ncWW","2XNW|1|A|C|26"],["2XNW|1|A|C|26","ncWW","2XNW|1|A|A|44"],["2XNW|1|A|G|37","ncSS","2XNW|1|A|U|34"],["2XNW|1|A|U|34","ncSS","2XNW|1|A|G|37"],["2XNW|1|A|U|47","ntWH","2XNW|1|A|U|51"],["2XNW|1|A|U|51","ntHW","2XNW|1|A|U|47"]]},"2XNZ":{"chains":["A"],"status":"ok","url":"https://www.ebi.ac.uk/pdbe/entry-files/download/2xnz_updated.cif","retrieved":"2026-10-22","cif_sha256":"e974743e5f8ad296c895abbfa027d9974202b69cf2ed9bb51b2e141d23eaf629","n_near_rows":4,"n_true_rows_local":66,"rows":[["2XNZ|1|A|G|37","ncSS","2XNZ|1|A|U|34"],["2XNZ|1|A|U|34","ncSS","2XNZ|1|A|G|37"],["2XNZ|1|A|U|47","ntWH","2XNZ|1|A|U|51"],["2XNZ|1|A|U|51","ntHW","2XNZ|1|A|U|47"]]},"2XO0":{"chains":["A"],"status":"ok","url":"https://www.ebi.ac.uk/pdbe/entry-files/download/2xo0_updated.cif","retrieved":"2026-10-22","cif_sha256":"2adbaad56b5546f809e981ebbddd6c7fbad3e1a78761704d71e5c34fc50e8723","n_near_rows":10,"n_true_rows_local":64,"rows":[["2XO0|1|A|A|44","ncWW","2XO0|1|A|C|26"],["2XO0|1|A|C|26","ncWW","2XO0|1|A|A|44"],["2XO0|1|A|G|37","ncSS","2XO0|1|A|U|34"],["2XO0|1|A|U|34","ncSS","2XO0|1|A|G|37"],["2XO0|1|A|U|47","ntWH","2XO0|1|A|U|51"],["2XO0|1|A|U|51","ntHW","2XO0|1|A|U|47"],["2XO0|1|A|U|51","ntWH","2XO0|1|A|ZZS|110||B"],["2XO0|1|A|U|74","ntWH","2XO0|1|A|ZZS|110||A"],["2XO0|1|A|ZZS|110||A","ntHW","2XO0|1|A|U|74"],["2XO0|1|A|ZZS|110||B","ntHW","2XO0|1|A|U|51"]]},"2XO1":{"chains":["A"],"status":"ok","url":"https://www.ebi.ac.uk/pdbe/entry-files/download/2xo1_updated.cif","retrieved":"2026-10-22","cif_sha256":"f289ac85f533f3df74f05e1de1995d1d99d72022b58102b88dca487da231e21b","n_near_rows":6,"n_true_rows_local":64,"rows":[["2XO1|1|A|G|37","ncSS","2XO1|1|A|U|34"],["2XO1|1|A|N6M|1081","ntSW","2XO1|1|A|U|51"],["2XO1|1|A|U|34","ncSS","2XO1|1|A|G|37"],["2XO1|1|A|U|47","ntWH","2XO1|1|A|U|51"],["2XO1|1|A|U|51","ntHW","2XO1|1|A|U|47"],["2XO1|1|A|U|51","ntWS","2XO1|1|A|N6M|1081"]]},"3DS7":{"chains":["A","B"],"status":"ok","url":"https://www.ebi.ac.uk/pdbe/entry-files/download/3ds7_updated.cif","retrieved":"2026-10-22","cif_sha256":"5da4b3a7aec4d9c3e73ce8d3eebcc230223918b1ab0d5322f87405682cb77ae0","n_near_rows":4,"n_true_rows_local":138,"rows":[["3DS7|1|A|G|37","ncSS","3DS7|1|A|U|34"],["3DS7|1|A|U|34","ncSS","3DS7|1|A|G|37"],["3DS7|1|B|G|237","ncSS","3DS7|1|B|U|234"],["3DS7|1|B|U|234","ncSS","3DS7|1|B|G|237"]]},"3FO4":{"chains":["A"],"status":"ok","url":"https://www.ebi.ac.uk/pdbe/entry-files/download/3fo4_updated.cif","retrieved":"2026-10-22","cif_sha256":"32bfa4dbb2ec9528f7f1c90c74d0c2d133b78928e804233a5f40818ab0165e55","n_near_rows":6,"n_true_rows_local":62,"rows":[["3FO4|1|A|6GU|91","ncWW","3FO4|1|A|U|74"],["3FO4|1|A|G|37","ncSS","3FO4|1|A|U|34"],["3FO4|1|A|U|34","ncSS","3FO4|1|A|G|37"],["3FO4|1|A|U|47","ntWH","3FO4|1|A|U|51"],["3FO4|1|A|U|51","ntHW","3FO4|1|A|U|47"],["3FO4|1|A|U|74","ncWW","3FO4|1|A|6GU|91"]]},"3FO6":{"chains":["A"],"status":"ok","url":"https://www.ebi.ac.uk/pdbe/entry-files/download/3fo6_updated.cif","retrieved":"2026-10-22","cif_sha256":"ea7ed1b043a384306aad022b0fd1d7b4040fe8705be580364f42b31928f060c1","n_near_rows":8,"n_true_rows_local":66,"rows":[["3FO6|1|A|6GO|91","ncWW","3FO6|1|A|C|74"],["3FO6|1|A|A|21","ncSS","3FO6|1|A|U|47"],["3FO6|1|A|C|74","ncWW","3FO6|1|A|6GO|91"],["3FO6|1|A|G|37","ncSS","3FO6|1|A|U|34"],["3FO6|1|A|U|34","ncSS","3FO6|1|A|G|37"],["3FO6|1|A|U|47","ncSS","3FO6|1|A|A|21"],["3FO6|1|A|U|47","ntWH","3FO6|1|A|U|51"],["3FO6|1|A|U|51","ntHW","3FO6|1|A|U|47"]]},"3G4M":{"chains":["A"],"status":"ok","url":"https://www.ebi.ac.uk/pdbe/entry-files/download/3g4m_updated.cif","retrieved":"2026-10-22","cif_sha256":"9d1efce55b9abbf2650f2f60f5e75fd0fc7bff5f3fd46e66911a9c84d778013b","n_near_rows":10,"n_true_rows_local":64,"rows":[["3G4M|1|A|2BP|91","ntWW","3G4M|1|A|C|74"],["3G4M|1|A|A|33","ncSS","3G4M|1|A|G|37"],["3G4M|1|A|A|44","ncWW","3G4M|1|A|C|26"],["3G4M|1|A|A|52","ncSW","3G4M|1|A|A|73"],["3G4M|1|A|A|73","ncWS","3G4M|1|A|A|52"],["3G4M|1|A|C|26","ncWW","3G4M|1|A|A|44"],["3G4M|1|A|C|74","ntWW","3G4M|1|A|2BP|91"],["3G4M|1|A|G|37","ncSS","3G4M|1|A